{
  "$schema": "../../platform/schema/lab.schema.json",
  "id": "bb-006-boardharbor-wildcard-websocket",
  "title": "BoardHarbor Wildcard WebSocket Leak",
  "summary": "Investigate a real-time broker where literal subscription authorization and wildcard dispatch combine to leak private activity across organizations.",
  "difficulty": "medium",
  "categories": ["Access Control", "WebSocket Security", "Multi-Tenancy"],
  "tags": [
    "stomp",
    "sockjs",
    "wildcard",
    "broken-access-control",
    "cross-tenant"
  ],
  "vulnType": "Cross-tenant data exposure through wildcard WebSocket subscription",
  "estimatedMinutes": 25,
  "author": "Ovawatch Security",
  "reportRef": "Sanitized realtime work-management platform finding adaptation",
  "runtime": {
    "type": "node",
    "install": "npm install",
    "start": "npm start",
    "readyPath": "/api/health",
    "defaultPort": 5080
  },
  "brief": "**BoardHarbor** is a fictional multi-tenant work-management platform with private organization boards and live updates delivered over SockJS and STOMP. The application supports self-service account and workspace creation. Two independent accounts are also provided: Avery is a Viewer in Northwind Studio, while Morgan is an Editor in Contoso Workshop.\n\nSign in as each user in separate browser profiles and use the application normally. Inspect the web client's network traffic to recover Avery's bearer token and concrete subscription format. Establish the REST and exact-topic authorization boundaries, then reproduce the broker behavior with the supplied CLI client or your own STOMP client.\n\nCredentials and identifiers are documented in the lab README. All data is synthetic, and the app binds to localhost.",
  "objectives": [
    "Sign in to both organizations in separate browser profiles and create ordinary board activity as the Contoso editor.",
    "Confirm the Viewer can read its own board but cannot retrieve the foreign board through REST.",
    "Show that an explicit subscription to the foreign board is denied.",
    "Change only the destination to /topic/** and obtain an accepted subscription.",
    "Generate private activity in the isolated organization and capture the leaked board event.",
    "Observe that the same wildcard also receives an administrative organization event.",
    "Restart with BROKER_MODE=fixed and confirm the wildcard is rejected."
  ],
  "hints": [
    {
      "text": "Start with /topic/boards/99002 and preserve its Access denied response as your negative control."
    },
    {
      "text": "The broker supports Ant-style destination matching. Try replacing the concrete path with a recursive topic pattern."
    },
    {
      "text": "After the subscription receipt arrives, click Generate private Contoso activity and inspect every MESSAGE destination."
    }
  ],
  "solution": "## Finding\n\nAvery is correctly denied when subscribing to `/topic/boards/99002`. The `/topic/**` subscription is accepted because the authorization layer only recognizes concrete board destinations. The broker later treats `**` as a recursive wildcard and dispatches both `/topic/boards/99002` and `/topic/admin/organizations/72002` to Avery.\n\n## Reproduction\n\n1. Sign in as Avery and inspect the normal WebSocket connection. The client authenticates over STOMP and subscribes to its own concrete board topic.\n2. Use Avery's bearer token with `GET /api/boards/99002`; it returns 404.\n3. Run `node scripts/poc.js /topic/boards/99002`; the socket returns `ERROR` with `Access denied`.\n4. Run `node scripts/poc.js /topic/**`. The subscription is accepted and the script creates an ordinary item as Morgan. Avery's socket receives the full private board event and an administrative organization event.\n5. Restart the server with `BROKER_MODE=fixed` and repeat the wildcard request. It is denied.\n\n## Root cause\n\nThe subscription interceptor compares the client-provided destination to owned objects as a literal string. The broker applies pattern matching later during dispatch. Authorization and delivery therefore interpret the same destination differently.\n\n## Remediation\n\nReject wildcard characters in client subscription destinations when legitimate clients use only concrete topics. Also bind subscriptions and message delivery to the organization identifier in the authenticated principal. If patterns are required, expand them first and authorize every concrete destination.",
  "links": []
}
